{
  "$schema": "http://json-schema.org/draft-07/schema#",
  "$id": "https://firenetworks.de/fbpkg/referenz-v1.schema.json",
  "title": "FBREF_v1 — Parameter-Referenz je Spiel",

  "description": "Fundstelle, nicht Wahrheit (E-21). Ein Paket sagt, was wir TUN; diese Datei sagt, was es GÄBE, mit Quelle und Datum. Aus ihr darf nichts in den Betrieb übernommen werden, ohne im Paket deklariert zu sein — sie ist Nachschlagewerk für Menschen, keine Quelle für Code. Der Abgleich mit dem Paket läuft über scripts/check-referenz.js.",

  "type": "object",
  "required": ["format", "slug", "checked_at", "sources"],
  "additionalProperties": false,

  "definitions": {
    "text": {
      "type": "object",
      "properties": { "de": { "type": "string" }, "en": { "type": "string" } },
      "additionalProperties": false,
      "minProperties": 1
    },

    "eintrag": {
      "type": "object",
      "required": ["name"],
      "additionalProperties": false,
      "properties": {
        "name": {
          "type": "string",
          "description": "Genau so, wie das Spiel es schreibt — mit Strich beim Startparameter (`-crossplay`), ohne bei einem Konfigurationsschlüssel. Diese Zeichenkette ist der Schlüssel für den Abgleich mit dem Paket."
        },
        "takes": {
          "description": "Was dahinter steht. `none` = reiner Schalter.",
          "enum": ["none", "text", "number", "boolean", "path", "enum", "pair"]
        },
        "values": {
          "type": "array",
          "description": "Bei `enum` die erlaubten Werte, exakt geschrieben.",
          "items": { "type": "string" }
        },
        "default": { "type": ["string", "number", "boolean", "null"] },
        "since": {
          "type": ["string", "null"],
          "description": "Ab welcher Spielfassung. null heißt: nicht ermittelt — nicht geraten."
        },
        "removed_in": {
          "type": ["string", "null"],
          "description": "Gesetzt, sobald das Spiel den Parameter fallen lässt. Der Eintrag bleibt stehen: gestrichen hieße vergessen."
        },
        "note": { "$ref": "#/definitions/text" },
        "source": {
          "type": "string",
          "description": "Belegstelle für DIESEN Eintrag, wenn sie von der allgemeinen Quellenliste abweicht."
        },
        "required": {
          "type": "boolean",
          "description": "Der Server startet ohne diesen Parameter nicht. Nur setzen, wenn es GEMESSEN ist — die Dokumentation eines Spiels nennt Pflichtangaben regelmäßig als optional. Vorgabe ist ungesetzt, nicht `false`: „nicht nachgesehen\" und „nachgesehen, ist optional\" sind zwei verschiedene Aussagen."
        },
        "gemessen_am": {
          "type": "string",
          "description": "Datum, an dem dieser Eintrag an einem LAUFENDEN Server nachgeprüft wurde (YYYY-MM-DD). Trennt Messung von Übernahme aus einer Quelle: Was hier ein Datum trägt, haben wir selbst gesehen.",
          "pattern": "^[0-9]{4}-[0-9]{2}-[0-9]{2}$"
        }
      }
    }
  },

  "properties": {
    "format": { "const": "FBREF_v1" },

    "slug": {
      "type": "string",
      "pattern": "^[a-z0-9][a-z0-9-]*$",
      "description": "Dasselbe Kürzel wie im Paket — daran findet der Abgleich das Gegenstück."
    },

    "checked_at": {
      "type": "string",
      "pattern": "^\\d{4}-\\d{2}-\\d{2}$",
      "description": "Wann ein Mensch das zuletzt gegen die Quelle gehalten hat. Wissen ohne Datum ist kein Wissen — nach sechs Monaten meldet der Abgleich es an."
    },

    "game_version": {
      "type": "string",
      "description": "Spielfassung, gegen die geprüft wurde, falls bekannt."
    },

    "sources": {
      "type": "array",
      "minItems": 1,
      "description": "Woher das Wissen stammt. Ohne Quelle ist ein Eintrag eine Behauptung.",
      "items": { "type": "string", "format": "uri" }
    },

    "note": {
      "$ref": "#/definitions/text",
      "description": "Was man über dieses Spiel wissen muss, bevor man die Listen liest."
    },

    "start_args": {
      "type": "array",
      "description": "Alles, was auf der Kommandozeile mitgegeben werden kann — auch was wir nicht anbieten. Genau das ist der Zweck.",
      "items": { "$ref": "#/definitions/eintrag" }
    },

    "config_keys": {
      "type": "array",
      "description": "Schlüssel in Konfigurationsdateien des Spiels. Leer heißt: geprüft und keine vorhanden — nicht `unbekannt`.",
      "items": { "$ref": "#/definitions/eintrag" }
    },

    "console_commands": {
      "type": "array",
      "description": "Befehle der Spielkonsole. Ob wir sie erreichen, steht im Paket unter `commands` — hier steht nur, dass es sie gibt.",
      "items": { "$ref": "#/definitions/eintrag" }
    }
  }
}
