{
  "format": "FBREF_v1",
  "slug": "valheim",
  "checked_at": "2026-08-16",
  "sources": [
    "https://www.valheimgame.com/support/a-guide-to-dedicated-servers/",
    "https://docs.unity3d.com/Manual/PlayerCommandLineArguments.html",
    "https://nodecraft.com/support/games/valheim/adding-world-modifiers-to-your-valheim-server"
  ],
  "note": {
    "de": "Valheim hat KEINE Konfigurationsdatei für den Server — alles läuft über die Kommandozeile. Zugriffsrechte stehen in drei Textdateien im Speicherverzeichnis (`adminlist.txt`, `bannedlist.txt`, `permittedlist.txt`), je Zeile eine Plattform-Spielerkennung im Format `[Plattform]_[Kennung]`. Eine Fernsteuerung (RCON) gibt es nicht: Die Konsolenbefehle unten wirken nur im Spiel selbst (F5) und nur für Spieler, die in `adminlist.txt` stehen. Weltmodifikatoren aus `-preset`/`-modifier`: Nodecraft schreibt, sie griffen nur beim ERSTEN Erzeugen einer Welt. Das ist am 2026-09-06 am laufenden Server NACHGEPRÜFT und WIDERLEGT — eine bestehende Welt, mit `-preset casual` geladen, meldet „Setting world modifier preset: casual“, und nach dem Laden der Welt rührt nichts es mehr an. Sie wirken also bei JEDEM Start; in der Einstellungskarte steht deshalb `wirkt_ab: restart`, nicht `neue_welt`. Die erlaubten Werte stehen gemessen im Paket.",
    "en": "Valheim has NO server config file — everything goes through the command line. Access control lives in three text files in the save directory (`adminlist.txt`, `bannedlist.txt`, `permittedlist.txt`), one platform user ID per line as `[Platform]_[UserID]`. There is no remote console: the console commands below only work in-game (F5) and only for players listed in `adminlist.txt`. World modifiers from `-preset`/`-modifier`/`-setkey` reportedly apply only when a world is first created; after that only via the in-game console. Not yet verified on a running server."
  },
  "start_args": [
    {
      "name": "-name",
      "takes": "text",
      "note": {
        "de": "Name in der Serverliste.",
        "en": "Name shown in the server browser."
      }
    },
    {
      "name": "-port",
      "takes": "number",
      "default": 2456,
      "note": {
        "de": "Belegt DIESEN Port und zusätzlich Port+1 für die Abfrage. Die Beziehung ist fest, nicht wählbar — deshalb `game+1` im Paket.",
        "en": "Uses this port AND port+1 for queries. The relation is fixed, not configurable — hence `game+1` in the package."
      }
    },
    {
      "name": "-world",
      "takes": "text",
      "default": "Dedicated",
      "note": {
        "de": "Lädt die Welt dieses Namens oder erzeugt eine neue, wenn es sie nicht gibt. Ein Tippfehler erzeugt lautlos eine leere Welt.",
        "en": "Loads the world of this name, or creates a new one if it does not exist. A typo silently creates an empty world."
      }
    },
    {
      "name": "-password",
      "takes": "text",
      "note": {
        "de": "Mindestens fuenf Zeichen und darf nicht im Servernamen vorkommen — sonst startet der Server nicht. GEMESSEN am 2026-08-23 an einem laufenden Server: Ohne Kennwort meldet Valheim „Error bad password: The password is too short“, danach ist die WorldGenerator-Instanz null und der Prozess endet mit Code 0. Der Parameter ist also nicht optional. Doku war hier kein Nachweis — die Messung ist es.",
        "en": "At least five characters and must not appear in the server name — otherwise the server refuses to start."
      },
      "required": true,
      "gemessen_am": "2026-08-23"
    },
    {
      "name": "-savedir",
      "takes": "path",
      "note": {
        "de": "Verlegt Welten UND die drei Rechtedateien. Wer ihn setzt, verschiebt damit auch die Sperrliste — für `management.saves` wichtig.",
        "en": "Moves worlds AND the three permission files. Setting it also moves the ban list — relevant for `management.saves`."
      }
    },
    {
      "name": "-public",
      "takes": "enum",
      "values": [
        "0",
        "1"
      ],
      "default": "1",
      "note": {
        "de": "1 = in der Serverliste sichtbar, 0 = nur über direkte Verbindung.",
        "en": "1 = listed in the browser, 0 = direct connect only."
      }
    },
    {
      "name": "-logFile",
      "takes": "path",
      "note": {
        "de": "Ohne diesen Parameter schreibt Valheim keine eigene Logdatei — die Ausgabe kommt nur über die Konsole. Beantwortet den offenen Punkt `management.logs` im Paket.",
        "en": "Without it Valheim writes no log file of its own — output comes via the console only. Answers the package's open point `management.logs`."
      }
    },
    {
      "name": "-saveinterval",
      "takes": "number",
      "default": 1800,
      "note": {
        "de": "Sekunden zwischen zwei Weltsicherungen.",
        "en": "Seconds between world saves."
      }
    },
    {
      "name": "-backups",
      "takes": "number",
      "default": 4,
      "note": {
        "de": "Wie viele automatische Sicherungen aufbewahrt werden.",
        "en": "How many automatic backups are retained."
      }
    },
    {
      "name": "-backupshort",
      "takes": "number",
      "default": 7200,
      "note": {
        "de": "Abstand der ersten automatischen Sicherungen.",
        "en": "Interval for the first automatic backups."
      }
    },
    {
      "name": "-backuplong",
      "takes": "number",
      "default": 43200,
      "note": {
        "de": "Abstand der weiteren Sicherungen.",
        "en": "Interval for subsequent backups."
      }
    },
    {
      "name": "-crossplay",
      "takes": "none",
      "note": {
        "de": "Betreibt den Server über das PlayFab-Netz statt über Steam. Kein Zusatz, sondern ein anderer Unterbau — deshalb kein reiner Komfortschalter.",
        "en": "Runs the server on the PlayFab backend instead of Steam. Not an add-on but a different backend — hence not a mere comfort toggle."
      }
    },
    {
      "name": "-instanceid",
      "takes": "text",
      "note": {
        "de": "Unterscheidet mehrere Server, die sich Port oder MAC-Adresse teilen. Für uns interessant, sobald mehrere Valheim-Server auf einem Rootserver laufen — genau unser Fall.",
        "en": "Distinguishes multiple servers sharing a port or MAC address. Relevant as soon as several Valheim servers run on one host — exactly our case."
      }
    },
    {
      "name": "-preset",
      "takes": "enum",
      "values": [
        "Normal",
        "Casual",
        "Easy",
        "Hard",
        "Hardcore",
        "Immersive",
        "Hammer"
      ],
      "note": {
        "de": "Setzt alle Weltmodifikatoren auf einmal und ÜBERSCHREIBT vorher gesetzte. Muss deshalb vor `-modifier` stehen.",
        "en": "Sets all world modifiers at once and OVERWRITES earlier ones. Must therefore come before `-modifier`."
      }
    },
    {
      "name": "-modifier",
      "takes": "pair",
      "values": [
        "Combat=veryeasy|easy|hard|veryhard",
        "DeathPenalty=casual|veryeasy|easy|hard|hardcore",
        "Resources=muchless|less|more|muchmore|most",
        "Raids=none|muchless|less|more|muchmore",
        "Portals=casual|hard|veryhard"
      ],
      "note": {
        "de": "Zwei Wörter je Vorkommen (`-modifier raids none`), mehrfach angebbar. Der jeweilige Normalwert hat KEINEN Namen — man lässt den Modifikator dann einfach weg.",
        "en": "Two words per occurrence (`-modifier raids none`), repeatable. The normal value has NO name — you simply omit the modifier."
      }
    },
    {
      "name": "-resetmodifiers",
      "takes": "none",
      "since": null,
      "note": {
        "de": "Nimmt alle gesetzten Weltmodifikatoren zurueck. Ohne ihn bleiben sie fuer immer in der `.fwl2` stehen — weglassen genuegt NICHT, weil die Welt sie speichert. Muss deshalb vor `-preset` und `-modifier` stehen. Nachgetragen am 2026-09-22: Der Parameter war seit Paket 1.0.15 in Benutzung und stand nicht in der Referenz, die vom 2026-08-16 stammt. Nicht mit `gemessen_am` versehen: Dass er wirklich abraeumt, ist an einem laufenden Server noch nicht nachgeprueft — dafuer muss jemand die `.fwl2` lesen (scripts/valheim-weltmodifikatoren.py, nur auf Rootserver 55).",
        "en": "Resets all world modifiers. Omitting them is NOT enough — the world keeps them in its `.fwl2` forever. Must come before `-preset` and `-modifier`."
      },
      "source": "https://nodecraft.com/support/games/valheim/adding-world-modifiers-to-your-valheim-server"
    },
    {
      "name": "-setkey",
      "takes": "enum",
      "values": [
        "nobuildcost",
        "playerevents",
        "passivemobs",
        "nomap"
      ],
      "note": {
        "de": "Reine Einschalter ohne Wert, mehrfach angebbar.",
        "en": "Pure on-switches without a value, repeatable."
      }
    },
    {
      "name": "-nographics",
      "takes": "none",
      "source": "https://docs.unity3d.com/Manual/PlayerCommandLineArguments.html",
      "note": {
        "de": "Kein Valheim-Parameter, sondern ein Unity-Parameter: kein Grafikgerät initialisieren. Steht deshalb in keinem Spielhandbuch.",
        "en": "Not a Valheim parameter but a Unity one: do not initialise a graphics device. Hence absent from any game manual."
      }
    },
    {
      "name": "-batchmode",
      "takes": "none",
      "source": "https://docs.unity3d.com/Manual/PlayerCommandLineArguments.html",
      "note": {
        "de": "Unity-Parameter: ohne Fenster und ohne Rückfragen laufen. Ebenfalls kein Valheim-Parameter.",
        "en": "Unity parameter: run headless and never prompt. Also not a Valheim parameter."
      }
    }
  ],
  "config_keys": [],
  "console_commands": [
    {
      "name": "kick",
      "takes": "text",
      "note": {
        "de": "`kick SPIELERNAME` — wirft einen Spieler heraus. Nur in der Spielkonsole (F5) durch einen Admin.",
        "en": "`kick PLAYERNAME` — removes a player. In-game console (F5) by an admin only."
      }
    },
    {
      "name": "ban",
      "takes": "text",